evidence_id,evidence_title,evidence_source,evidence_date,existing_count,existing_promise_ids,existing_promise_texts,semantic_count,semantic_promise_ids,semantic_promise_texts,semantic_scores,overlap_count,new_semantic_count,lost_existing_count
20211220_44_News_9127739ca9,Chief Public Health Officer delivers remarks on the COVID-19 situation and public health measures.,News Release (Canada.ca),2021-12-20 14:12:08+00:00,3,LPC_20211216_MANDL_679b3676 | LPC_20211216_MANDL_1b3c1d21 | LPC_20211216_MANDL_ec3f2f6c,"Reinforce compliance under the Canada Health Act. | Take increased and expedited action to monitor, prevent and mitigate the threat of antimicrobial res... | Ensure vaccination is enforced for workers at Crown corporations and separate agencies.",22,LPC_20211216_MANDL_dd972e07 | LPC_20211216_MANDL_7447a219 | LPC_20211216_MANDL_65dfd182 | LPC_20211216_MANDL_37674758 | LPC_20211216_MANDL_6b5efd52 | LPC_20211216_MANDL_9a694121 | LPC_20211216_MANDL_0de02309 | LPC_20211216_MANDL_26b431ea | LPC_20211216_MANDL_27264693 | LPC_20211216_MANDL_89d2f175,"Ensure the Public Health Agency of Canada has the resources and support necessary to continue protec... | Strengthen surveillance and capacity to detect and act on public health threats. | Ensure vaccination across the Public Service. | Contribute to Canada’s response to COVID-19, including by responding to Requests for Federal Assista... | Continue the roll-out of COVID-19 vaccines. | Ensure science and evidence are integrated into Canada's pandemic response. | Reinforce international efforts to ensure that people around the world have access to health interve... | Ensure the Government of Canada continues to be prepared to proactively mitigate and respond to emer... | Work with federally regulated workplaces to ensure that COVID-19 vaccination is enforced. | Continue contributing to Canada’s response to COVID-19, including by protecting the health and safet...",0.701 | 0.690 | 0.680 | 0.675 | 0.658 | 0.618 | 0.613 | 0.601 | 0.600 | 0.598,1,21,2
20211220_44_News_91da84360f,"Chief Public Health Officer Dr. Theresa Tam issued a statement on COVID-19 on October 15, 2021.",News Release (Canada.ca),2021-12-20 14:26:49+00:00,3,LPC_20211216_MANDL_6b5efd52 | LPC_20211216_MANDL_7447a219 | LPC_20211216_MANDL_1ca45b6a,Continue the roll-out of COVID-19 vaccines. | Strengthen surveillance and capacity to detect and act on public health threats. | Provide regular updates to the PM and Cabinet on Canada’s preparedness and response across all hazar...,3,LPC_20211216_MANDL_dd972e07 | LPC_20211216_MANDL_65dfd182 | LPC_20211216_MANDL_7447a219,Ensure the Public Health Agency of Canada has the resources and support necessary to continue protec... | Ensure vaccination across the Public Service. | Strengthen surveillance and capacity to detect and act on public health threats.,0.611 | 0.584 | 0.574,1,2,2
20211220_44_News_abe7d43de8,Chief Public Health Officer delivers remarks addressing the ongoing COVID-19 pandemic.,News Release (Canada.ca),2021-12-20 14:46:58+00:00,3,LPC_20211216_MANDL_6b5efd52 | LPC_20211216_MANDL_65dfd182 | LPC_20211216_MANDL_e2a9a126,"Continue the roll-out of COVID-19 vaccines. | Ensure vaccination across the Public Service. | Ensure implementation of and adherence to public health measures, and support the availability of ra...",2,LPC_20211216_MANDL_dd972e07 | LPC_20211216_MANDL_65dfd182,Ensure the Public Health Agency of Canada has the resources and support necessary to continue protec... | Ensure vaccination across the Public Service.,0.575 | 0.572,1,1,2
20211220_44_News_d2c61bb945,Chief Public Health Officer Dr. Theresa Tam issued a statement regarding the ongoing COVID-19 pandemic.,News Release (Canada.ca),2021-12-20 19:38:28+00:00,3,LPC_20211216_MANDL_6b5efd52 | LPC_20211216_MANDL_65dfd182 | LPC_20211216_MANDL_f7d0dd7f,Continue the roll-out of COVID-19 vaccines. | Ensure vaccination across the Public Service. | Improve the operation of health surveillance systems to bolster national resilience and readiness fo...,4,LPC_20211216_MANDL_dd972e07 | LPC_20211216_MANDL_7447a219 | LPC_20211216_MANDL_65dfd182 | LPC_20211216_MANDL_37674758,"Ensure the Public Health Agency of Canada has the resources and support necessary to continue protec... | Strengthen surveillance and capacity to detect and act on public health threats. | Ensure vaccination across the Public Service. | Contribute to Canada’s response to COVID-19, including by responding to Requests for Federal Assista...",0.627 | 0.589 | 0.577 | 0.567,1,3,2
20211220_44_News_d5f51fa29e,"G7 foreign ministers, including Canada, express grave concern over the erosion of democratic elements in Hong Kong's Legislative Council elections.",News Release (Canada.ca),2021-12-20 15:54:14+00:00,3,LPC_20211216_MANDL_b4963f2e | LPC_20211216_MANDL_5393fdd9 | LPC_20211216_MANDL_6155ce99,Convene and coordinate the Ministers responsible for the Regional Development Agencies to promote a ... | Advance an action plan to coordinate collective international responses to specific incidents of arb... | Support and implement the Justice for Victims of Corrupt Foreign Officials Act and promote the adopt...,0,,,,0,0,3
20211220_44_OIC_298559ed59,"Governor General in Council appoints multiple Ambassadors, High Commissioners, and Consuls General to represent Canada internationally.",OrderInCouncil (PCO),2021-12-20 00:00:00+00:00,3,LPC_20211216_MANDL_37d47ca0 | LPC_20211216_MANDL_6e63413b | LPC_20211216_MANDL_946c1abe,Expand the coalition of states supporting Canada's initiative to condemn and eradicate arbitrary det... | Introduce a reciprocal procurement policy that will ensure goods and services are procured from coun... | Celebrate Canada’s unique francophone cultures through the promotion of the French language across C...,0,,,,0,0,3
20211220_44_OIC_7d3f42fca1,Minister of Health makes regulations amending Patented Medicines Regulations regarding additional factors and information reporting.,OrderInCouncil (PCO),2021-12-20 00:00:00+00:00,3,LPC_20211216_MANDL_8c7f793a | LPC_20211216_MANDL_3aa1dd37 | LPC_20211216_MANDL_bdb9d343,Introduce mandatory labelling of chemicals in consumer products. | Support youth-led and youth-focused organizations that respond to the unique sexual and reproductive... | Introduce legislation to end testing on animals.,0,,,,0,0,3
20211221_44_News_11395eec90,Chief Public Health Officer Dr. Theresa Tam issued a statement regarding COVID-19.,News Release (Canada.ca),2021-12-21 14:16:28+00:00,3,LPC_20211216_MANDL_6b5efd52 | LPC_20211216_MANDL_7447a219 | LPC_20211216_MANDL_907cd355,"Continue the roll-out of COVID-19 vaccines. | Strengthen surveillance and capacity to detect and act on public health threats. | Continue to procure COVID-19 therapeutics, tests and vaccines to ensure all Canadians have access to...",3,LPC_20211216_MANDL_dd972e07 | LPC_20211216_MANDL_65dfd182 | LPC_20211216_MANDL_7447a219,Ensure the Public Health Agency of Canada has the resources and support necessary to continue protec... | Ensure vaccination across the Public Service. | Strengthen surveillance and capacity to detect and act on public health threats.,0.608 | 0.573 | 0.560,1,2,2
20211221_44_News_26cda3444d,Chief Public Health Officer issued statement on COVID-19.,News Release (Canada.ca),2021-12-21 14:43:08+00:00,3,LPC_20211216_MANDL_dd972e07 | LPC_20211216_MANDL_6b5efd52 | LPC_20211216_MANDL_ec3f2f6c,Ensure the Public Health Agency of Canada has the resources and support necessary to continue protec... | Continue the roll-out of COVID-19 vaccines. | Ensure vaccination is enforced for workers at Crown corporations and separate agencies.,1,LPC_20211216_MANDL_dd972e07,Ensure the Public Health Agency of Canada has the resources and support necessary to continue protec...,0.679,1,0,2
20211221_44_News_443b30cc7c,Chief Public Health Officer issued a statement on COVID-19.,News Release (Canada.ca),2021-12-21 14:20:07+00:00,3,LPC_20211216_MANDL_6b5efd52 | LPC_20211216_MANDL_7447a219 | LPC_20211216_MANDL_65dfd182,Continue the roll-out of COVID-19 vaccines. | Strengthen surveillance and capacity to detect and act on public health threats. | Ensure vaccination across the Public Service.,9,LPC_20211216_MANDL_dd972e07 | LPC_20211216_MANDL_65dfd182 | LPC_20211216_MANDL_7447a219 | LPC_20211216_MANDL_37674758 | LPC_20211216_MANDL_6b5efd52 | LPC_20211216_MANDL_89d2f175 | LPC_20211216_MANDL_0de02309 | LPC_20211216_MANDL_ec3f2f6c | LPC_20211216_MANDL_9a694121,"Ensure the Public Health Agency of Canada has the resources and support necessary to continue protec... | Ensure vaccination across the Public Service. | Strengthen surveillance and capacity to detect and act on public health threats. | Contribute to Canada’s response to COVID-19, including by responding to Requests for Federal Assista... | Continue the roll-out of COVID-19 vaccines. | Continue contributing to Canada’s response to COVID-19, including by protecting the health and safet... | Reinforce international efforts to ensure that people around the world have access to health interve... | Ensure vaccination is enforced for workers at Crown corporations and separate agencies. | Ensure science and evidence are integrated into Canada's pandemic response.",0.653 | 0.624 | 0.619 | 0.602 | 0.580 | 0.579 | 0.557 | 0.557 | 0.554,3,6,0
20211221_44_News_479beb6a6b,Chief Public Health Officer delivers remarks on COVID-19 pandemic response.,News Release (Canada.ca),2021-12-21 15:41:57+00:00,3,LPC_20211216_MANDL_89d2f175 | LPC_20211216_MANDL_26b431ea | LPC_20211216_MANDL_1add68c2,"Continue contributing to Canada’s response to COVID-19, including by protecting the health and safet... | Ensure the Government of Canada continues to be prepared to proactively mitigate and respond to emer... | Sustain improved access to virtual mental health services with Wellness Together Canada.",10,LPC_20211216_MANDL_37674758 | LPC_20211216_MANDL_dd972e07 | LPC_20211216_MANDL_7447a219 | LPC_20211216_MANDL_65dfd182 | LPC_20211216_MANDL_9a694121 | LPC_20211216_MANDL_6b5efd52 | LPC_20211216_MANDL_0de02309 | LPC_20211216_MANDL_26b431ea | LPC_20211216_MANDL_89d2f175 | LPC_20211216_MANDL_159fdd5a,"Contribute to Canada’s response to COVID-19, including by responding to Requests for Federal Assista... | Ensure the Public Health Agency of Canada has the resources and support necessary to continue protec... | Strengthen surveillance and capacity to detect and act on public health threats. | Ensure vaccination across the Public Service. | Ensure science and evidence are integrated into Canada's pandemic response. | Continue the roll-out of COVID-19 vaccines. | Reinforce international efforts to ensure that people around the world have access to health interve... | Ensure the Government of Canada continues to be prepared to proactively mitigate and respond to emer... | Continue contributing to Canada’s response to COVID-19, including by protecting the health and safet... | Modernize how services and benefits are delivered to Canadians in times of crisis to bolster nationa...",0.650 | 0.643 | 0.635 | 0.617 | 0.585 | 0.584 | 0.573 | 0.572 | 0.567 | 0.556,2,8,1
20211221_44_News_4c270e9a8e,Health Canada receives submission from Pfizer-BioNTech for authorization of Comirnaty COVID-19 vaccine for children aged 5-11.,News Release (Canada.ca),2021-12-21 19:01:16+00:00,3,LPC_20211216_MANDL_b4d6afae | LPC_20211216_MANDL_8c7f793a | LPC_20211216_MANDL_dd972e07,Proceed with a national strategy on high-cost drugs for rare diseases. | Introduce mandatory labelling of chemicals in consumer products. | Ensure the Public Health Agency of Canada has the resources and support necessary to continue protec...,10,LPC_20211216_MANDL_907cd355 | LPC_20211216_MANDL_6b5efd52 | LPC_20211216_MANDL_0de02309 | LPC_20211216_MANDL_d6478e87 | LPC_20211216_MANDL_2cbef2e8 | LPC_20211216_MANDL_0e4ce636 | LPC_20211216_MANDL_0bdfac5b | LPC_20211216_MANDL_65dfd182 | LPC_20211216_MANDL_dd972e07 | LPC_20211216_MANDL_37674758,"Continue to procure COVID-19 therapeutics, tests and vaccines to ensure all Canadians have access to... | Continue the roll-out of COVID-19 vaccines. | Reinforce international efforts to ensure that people around the world have access to health interve... | Ensure sufficient domestic supply of COVID-19 vaccines and therapeutics, evaluate Canada's border po... | Launch a COVID-19 Proof of Vaccination Fund to support provinces and territories who implement a req... | Reinforce international efforts to ensure that people around the world have access to health interve... | Provide additional funding for enhanced testing and vaccine production capacity in developing countr... | Ensure vaccination across the Public Service. | Ensure the Public Health Agency of Canada has the resources and support necessary to continue protec... | Contribute to Canada’s response to COVID-19, including by responding to Requests for Federal Assista...",0.676 | 0.663 | 0.646 | 0.627 | 0.610 | 0.593 | 0.592 | 0.591 | 0.574 | 0.554,1,9,2
